executive_order_number,title,publication_date,signing_date,citation,document_number,executive_order_notes,html_url
13652,Continuance Of Certain Federal Advisory Committees,10/04/2013,09/30/2013,78 FR 61817, 2013-24388,"Amends: EO 13043, April 16, 1997; EO 13231, October 16, 2001; EO 13515, October 14, 2009; EO 13538, April 19, 2010; EO 13600, February 9, 2012
; Supersedes in part: EO 13585, September 30, 2011; EO 13591, November 23, 2011
; Continues: EO 11145, March 7, 1964; EO 11183, October 3, 1964; EO 11287, June 28, 1966; EO 11612, July 26, 1971; EO 12131, May 4, 1979; EO 12216, June 19, 1980; EO 12367, June 15, 1982; EO 12382, September 13, 1982; EO 12829, January 6, 1993; EO 12905, March 25, 1994; EO 12994, March 21, 1996; EO 13231, October 16, 2001; EO 13265, June 6, 2002; EO 13515, October 14, 2009; EO 13521, November 24, 2009; EO 13522, December 9, 2009; EO 13532, February 26, 2010; EO 13538, April 19, 2010; EO 13539, April 21, 2010; EO 13540, April 26, 2010; EO 13549, August 18, 2010; EO 13600, February 9, 2012; EO 13621, July 26, 2012; EO 13631, December 7, 2012; EO 13634, December 21, 2012; EO 13640, January 5, 2013
; ee: EO 13498, February 5, 2009; EO 13544, June 10, 2010; EO 13555, October 19, 2010",https://www.federalregister.gov/articles/2013/10/04/2013-24388/continuance-of-certain-federal-advisory-committees
13653,Preparing the United States for the Impacts of Climate Change,11/06/2013,11/01/2013,78 FR 66817, 2013-26785,"See:   EO 13677, September 23, 2014; EO 13683, December 11, 2014",https://www.federalregister.gov/articles/2013/11/06/2013-26785/preparing-the-united-states-for-the-impacts-of-climate-change
13654,Establishing an Emergency Board To Investigate Disputes Between the Long Island Rail Road Company and Certain of Its Employees Represented by Certain Labor Organizations,11/26/2013,11/21/2013,78 FR 70843, 2013-28581,"See: EO 13663, March 20, 2014",https://www.federalregister.gov/articles/2013/11/26/2013-28581/establishing-an-emergency-board-to-investigate-disputes-between-the-long-island-rail-road-company
13655,Adjustments of Certain Rates of Pay,12/31/2013,12/23/2013,78 FR 80451, 2013-31445,"Supersedes: EO 13641, April 5, 2013; EO 13686, December 19, 2014",https://www.federalregister.gov/articles/2013/12/31/2013-31445/adjustments-of-certain-rates-of-pay
13656,Establishment of Afghanistan and Pakistan Strategic Partnership Office and Amendment to Executive Order 12163,01/24/2014,01/17/2014,79 FR 4261, 2014-01523,"Amends: EO 12163, September 29, 1979",https://www.federalregister.gov/articles/2014/01/24/2014-01523/establishment-of-afghanistan-and-pakistan-strategic-partnership-office-and-amendment-to-executive
13657,Changing the Name of the National Security Staff to the National Security Council Staff,02/14/2014,02/10/2014,79 FR 8823, 2014-03474,"",https://www.federalregister.gov/articles/2014/02/14/2014-03474/changing-the-name-of-the-national-security-staff-to-the-national-security-council-staff
13658,Establishing a Minimum Wage for Contractors,02/20/2014,02/12/2014,79 FR 9849, 2014-03805,"See:   EO 13673, July 31, 2014",https://www.federalregister.gov/articles/2014/02/20/2014-03805/establishing-a-minimum-wage-for-contractors
13659,Streamlining the Export/Import Process for America's Businesses,02/25/2014,02/19/2014,79 FR 10655, 2014-04254,"",https://www.federalregister.gov/articles/2014/02/25/2014-04254/streamlining-the-exportimport-process-for-americas-businesses
13660,Blocking Property of Certain Persons Contributing to the Situation in Ukraine,03/10/2014,03/06/2014,79 FR 13491, 2014-05323,"See: EO 13661, March 16, 2014; EO 13662, March 20, 2014; EO 13685, December 19, 2014 ",https://www.federalregister.gov/articles/2014/03/10/2014-05323/blocking-property-of-certain-persons-contributing-to-the-situation-in-ukraine
13661,Blocking Property of Additional Persons Contributing to the Situation in Ukraine,03/19/2014,03/16/2014,79 FR 15533, 2014-06141,"See: EO 13660, March 6, 2014; EO 13662, March 20, 2014; EO 13685, December 19, 2014",https://www.federalregister.gov/articles/2014/03/19/2014-06141/blocking-property-of-additional-persons-contributing-to-the-situation-in-ukraine
13662,Blocking Property of Additional Persons Contributing to the Situation in Ukraine,03/24/2014,03/20/2014,79 FR 16167, 2014-06612,"See: EO 13660, March 6, 2014; EO 13661, March 16, 2014; EO 13685, December 19, 2014",https://www.federalregister.gov/articles/2014/03/24/2014-06612/blocking-property-of-additional-persons-contributing-to-the-situation-in-ukraine
13663,Establishing an Emergency Board to Investigate Disputes Between the Long Island Rail Road Company and Certain of Its Employees Represented by Certain Labor Organizations,03/25/2014,03/20/2014,79 FR 16645, 2014-06768,"See: EO 13654, November 21, 2013",https://www.federalregister.gov/articles/2014/03/25/2014-06768/establishing-an-emergency-board-to-investigate-disputes-between-the-long-island-rail-road-company
13664,Blocking Property of Certain Persons With Respect to South Sudan,04/07/2014,04/03/2014,79 FR 19281, 2014-07895,"",https://www.federalregister.gov/articles/2014/04/07/2014-07895/blocking-property-of-certain-persons-with-respect-to-south-sudan
13665,Non-Retaliation for Disclosure of Compensation Information,04/11/2014,04/08/2014,79 FR 20749, 2014-08426,"",https://www.federalregister.gov/articles/2014/04/11/2014-08426/non-retaliation-for-disclosure-of-compensation-information
13666,Expanding Eligibility for the Defense Meritorious Service Medal,04/23/2014,04/18/2014,79 FR 22591, 2014-09343,"",https://www.federalregister.gov/articles/2014/04/23/2014-09343/expanding-eligibility-for-the-defense-meritorious-service-medal
13667,Blocking Property of Certain Persons Contributing to the Conflict in the Central African Republic,05/15/2014,05/12/2014,79 FR 28385, 2014-11442,"",https://www.federalregister.gov/articles/2014/05/15/2014-11442/blocking-property-of-certain-persons-contributing-to-the-conflict-in-the-central-african-republic
13668,"Ending Immunities Granted to the Development Fund for Iraq and Certain Other Iraqi Property and Interests in Property Pursuant to Executive Order 13303, as Amended",05/29/2014,05/27/2014,79 FR 31019, 2014-12651,"See: EO 13303, May 22, 2003; EO 13364, November 29, 2004; EO 13315, August 28, 2003",https://www.federalregister.gov/articles/2014/05/29/2014-12651/ending-immunities-granted-to-the-development-fund-for-iraq-and-certain-other-iraqi-property-and
13669,"2014 Amendments to the Manual for Courts-Martial, United States",06/18/2014,06/13/2014,79 FR 34999, 2014-14429,"Amends: EO 12473, April 13, 1984",https://www.federalregister.gov/articles/2014/06/18/2014-14429/2014-amendments-to-the-manual-for-courts-martial-united-states
13670,Establishing an Emergency Board To Investigate Disputes Between the Southeastern Pennsylvania Transportation Authority and Certain of Its Employees Represented by Certain Labor Organizations,06/18/2014,06/14/2014,79 FR 35029, 2014-14432,"",https://www.federalregister.gov/articles/2014/06/18/2014-14432/establishing-an-emergency-board-to-investigate-disputes-between-the-southeastern-pennsylvania
13671,Taking Additional Steps to Address the National Emergency With Respect to the Conflict in the Democratic Republic of the Congo,07/10/2014,07/08/2014,79 FR 39947, 2014-16360,"Amends: EO 13413, October 27, 2006",https://www.federalregister.gov/articles/2014/07/10/2014-16360/taking-additional-steps-to-address-the-national-emergency-with-respect-to-the-conflict-in-the
13672,"Further Amendments to Executive Order 11478, Equal Employment Opportunity in the Federal Government, and Executive Order 11246, Equal Employment Opportunity",07/23/2014,07/21/2014,79 FR 42971, 2014-17522,"Amends: EO 11246, September 24, 1965; EO 11478, August 8, 1969",https://www.federalregister.gov/articles/2014/07/23/2014-17522/further-amendments-to-executive-order-11478-equal-employment-opportunity-in-the-federal-government
13673,Fair Pay and Safe Workplaces,08/05/2014,07/31/2014,79 FR 45309, 2014-18561,"See: EO 11246, September 24, 1965; EO 13658, February 12, 2014; EO 13683, December 11, 2014 ",https://www.federalregister.gov/articles/2014/08/05/2014-18561/fair-pay-and-safe-workplaces
13674,Revised List of Quarantinable Communicable Diseases,08/06/2014,07/31/2014,79 FR 45671, 2014-18682,"",https://www.federalregister.gov/articles/2014/08/06/2014-18682/revised-list-of-quarantinable-communicable-diseases
13675,Establishing the President's Advisory Council on Doing Business in Africa,08/08/2014,08/05/2014,79 FR 46659, 2014-18998,"",https://www.federalregister.gov/articles/2014/08/08/2014-18998/establishing-the-presidents-advisory-council-on-doing-business-in-africa
13676,Combating Antibiotic-Resistant Bacteria,09/23/2014,09/18/2014,79 FR 56931, 2014-22805,"",https://www.federalregister.gov/articles/2014/09/23/2014-22805/combating-antibiotic-resistant-bacteria
13677,Climate-Resilient International Development,09/26/2014,09/23/2014,79 FR 58229, 2014-23228,"See: EO 13514, October 5, 2009; EO 13653, November 1, 2013",https://www.federalregister.gov/articles/2014/09/26/2014-23228/climate-resilient-international-development
13678,"Conversion Authority for Criminal Investigators (Special Agents) of the Bureau of Alcohol, Tobacco, Firearms, and Explosives",10/08/2014,10/03/2014,79 FR 60949, 2014-24218,"",https://www.federalregister.gov/articles/2014/10/08/2014-24218/conversion-authority-for-criminal-investigators-special-agents-of-the-bureau-of-alcohol-tobacco
13679,Establishing an Emergency Board To Investigate a Dispute Between the Southeastern Pennsylvania Transportation Authority and Its Locomotive Engineers Represented by the Brotherhood of Locomotive Engineers and Trainmen,10/17/2014,10/10/2014,79 FR 62323, 2014-24851," EO 13679, October 10, 2014",https://www.federalregister.gov/articles/2014/10/17/2014-24851/establishing-an-emergency-board-to-investigate-a-dispute-between-the-southeastern-pennsylvania
13680,Ordering the Selected Reserve and Certain Individual Ready Reserve Members of the Armed Forces to Active Duty,10/23/2014,10/16/2014,79 FR 63287, 2014-25292,"",https://www.federalregister.gov/articles/2014/10/23/2014-25292/ordering-the-selected-reserve-and-certain-individual-ready-reserve-members-of-the-armed-forces-to
13681,Improving the Security of Consumer Financial Transactions,10/23/2014,10/17/2014,79 FR 63489, 2014-25439,"",https://www.federalregister.gov/articles/2014/10/23/2014-25439/improving-the-security-of-consumer-financial-transactions
13682,"Closing of Executive Departments and Agencies of the Federal Government on Friday, December 26, 2014",12/10/2014,12/05/2014,79 FR 73457, 2014-29121,"",https://www.federalregister.gov/articles/2014/12/10/2014-29121/closing-of-executive-departments-and-agencies-of-the-federal-government-on-friday-december-26-2014
13683,"Amendments to Executive Orders 11030, 13653, and 13673",12/16/2014,12/11/2014,79 FR 75039, 2014-29625,"Amends: EO 11030, June 19, 1962; EO 13653, November 1, 2013; EO 13673, July 31, 2014
; See: EO 13653, November 1, 2013",https://www.federalregister.gov/articles/2014/12/16/2014-29625/amendments-to-executive-orders-11030-13653-and-13673
13684,Establishment of the President's Task Force on 21st Century Policing,12/23/2014,12/18/2014,79 FR 76865, 2014-30195,"",https://www.federalregister.gov/articles/2014/12/23/2014-30195/establishment-of-the-presidents-task-force-on-21st-century-policing
13685,Blocking Property of Certain Persons and Prohibiting Certain Transactions With Respect to the Crimea Region of Ukraine,12/24/2014,12/19/2014,79 FR 77357, 2014-30323,"See: EO 13660, March 6, 2014; EO 13661, March 16, 2014; EO 13662, March 20, 2014",https://www.federalregister.gov/articles/2014/12/24/2014-30323/blocking-property-of-certain-persons-and-prohibiting-certain-transactions-with-respect-to-the-crimea
13686,Adjustments of Certain Rates of Pay,12/24/2014,12/19/2014,79 FR 77361, 2014-30363,"Supersedes: EO 13655, December 23, 2013",https://www.federalregister.gov/articles/2014/12/24/2014-30363/adjustments-of-certain-rates-of-pay
13687,Imposing Additional Sanctions With Respect To North Korea,01/06/2015,01/02/2015,80 FR 817, 2015-00058,"",https://www.federalregister.gov/articles/2015/01/06/2015-00058/imposing-additional-sanctions-with-respect-to-north-korea
13688,Federal Support for Local Law Enforcement Equipment Acquisition,01/22/2015,01/16/2015,80 FR 3451, 2015-01255,"",https://www.federalregister.gov/articles/2015/01/22/2015-01255/federal-support-for-local-law-enforcement-equipment-acquisition
13689,Enhancing Coordination of National Efforts in the Arctic,01/26/2015,01/21/2015,80 FR 4189, 2015-01522,"",https://www.federalregister.gov/articles/2015/01/26/2015-01522/enhancing-coordination-of-national-efforts-in-the-arctic
13690,Establishing a Federal Flood Risk Management Standard and a Process for Further Soliciting and Considering Stakeholder Input,02/04/2015,01/30/2015,80 FR 6425, 2015-02379,"",https://www.federalregister.gov/articles/2015/02/04/2015-02379/establishing-a-federal-flood-risk-management-standard-and-a-process-for-further-soliciting-and
13691,Promoting Private Sector Cybersecurity Information Sharing,02/20/2015,02/13/2015,80 FR 9347, 2015-03714,"",https://www.federalregister.gov/articles/2015/02/20/2015-03714/promoting-private-sector-cybersecurity-information-sharing
13692,Blocking Property and Suspending Entry of Certain Persons Contributing to the Situation in Venezuela,03/11/2015,03/08/2015,80 FR 12747, 2015-05677,"",https://www.federalregister.gov/articles/2015/03/11/2015-05677/blocking-property-and-suspending-entry-of-certain-persons-contributing-to-the-situation-in-venezuela
13693,Planning for Federal Sustainability in the Next Decade,03/25/2015,03/19/2015,80 FR 15869, 2015-07016,"",https://www.federalregister.gov/articles/2015/03/25/2015-07016/planning-for-federal-sustainability-in-the-next-decade
13694,Blocking the Property of Certain Persons Engaging in Significant Malicious Cyber-Enabled Activities,04/02/2015,04/01/2015,80 FR 18077, 2015-07788,"",https://www.federalregister.gov/articles/2015/04/02/2015-07788/blocking-the-property-of-certain-persons-engaging-in-significant-malicious-cyber-enabled-activities
15323,"Half-Day Closing of Executive Departments and Agencies on Thursday, December 24, 2009",12/16/2009,12/11/2009,74 FR 66563, E9-30020,"Federal Register correction page and date: 74 FR 67049, December 18, 2009",https://www.federalregister.gov/articles/2009/12/16/E9-30020/half-day-closing-of-executive-departments-and-agencies-on-thursday-december-24-2009
